title,author,content,published_date
Chemical Reactions in Everyday Life,Alice,"Chemical reactions are all around us, from the food we eat to the air we breathe. In this blog post, we explore some common chemical reactions that occur in everyday life.",2024-04-23
The Science of Cooking,Bob,"Cooking is not just an art, it's also a science! Learn about the chemical reactions that take place when you cook your favorite meals and how they affect the taste and texture of food.",2024-04-24
Mathematical Puzzles and Riddles,Charlie,"Put your math skills to the test with these challenging puzzles and riddles! From geometry to algebra, these brain teasers will keep you entertained for hours.",2024-04-25
DIY Beauty Hacks for Glowing Skin,Diana,"Achieve glowing skin with these easy DIY beauty hacks! From natural ingredients to simple skincare routines, we've got everything you need to enhance your natural beauty.",2024-04-26
Chemistry of Food Preservation,Ellen,"Ever wonder how food stays fresh for so long? Explore the chemistry behind food preservation methods like canning, freezing, and drying in this informative blog post.",2024-04-27
The Art of Baking: Science Behind the Perfect Cake,Frank,"Baking is both an art and a science. Learn about the chemical reactions that occur during baking and how they affect the taste, texture, and appearance of your favorite treats.",2024-04-28
Mathematical Principles in Nature,Gina,"Mathematics is everywhere, even in nature! Discover the mathematical principles behind natural phenomena like the Fibonacci sequence, fractals, and the golden ratio.",2024-04-29
10 Easy Recipes for Busy Weeknights,Henry,"Short on time but still want a delicious meal? Try these 10 easy recipes that can be whipped up in no time, perfect for busy weeknights when you need dinner on the table fast.",2024-04-30
The Beauty of Mathematics,Hannah,"Mathematics is more than just numbers and equations, it's a beautiful and elegant subject with deep connections to art, music, and nature. Explore the beauty of mathematics in this captivating blog post.",2024-05-01
Natural Skincare Ingredients and Their Benefits,Ivy,"Tired of harsh chemicals in your skincare products? Discover the benefits of natural ingredients like coconut oil, honey, and avocado for healthier, glowing skin.",2024-05-02
Chemistry of Perfumes and Fragrances,Jack,"Ever wonder how perfumes and fragrances are made? Dive into the fascinating world of chemistry to learn about the ingredients and processes behind your favorite scents.",2024-05-03
The Math Behind Music: Exploring Harmonics and Frequencies,Kate,"Music and mathematics have a deep and intertwined relationship. Explore the mathematical principles that govern music, from harmonics and frequencies to rhythm and melody.",2024-05-04
Healthy Cooking Tips for Weight Loss,Liam,"Eating healthy doesn't have to be boring! Discover simple cooking tips and techniques to help you lose weight without sacrificing flavor or satisfaction.",2024-05-05
Chemistry of Skincare Products,Lucy,"From cleansers to moisturizers, skincare products are full of chemical compounds designed to keep your skin healthy and radiant. Learn about the chemistry behind your favorite skincare products.",2024-05-06
The Joy of Baking: Creating Memories in the Kitchen,Max,"Baking is more than just making delicious treats, it's about creating memories with loved ones and sharing moments of joy. Discover the joy of baking in this heartwarming blog post.",2024-05-07
Mathematical Games and Puzzles for Kids,Nora,"Make learning math fun with these engaging games and puzzles designed specifically for kids! From number games to logic puzzles, these activities will keep young minds entertained and engaged.",2024-05-08
Healthy Eating Habits for Clear Skin,Oscar,"What you eat can have a big impact on the health of your skin. Discover healthy eating habits and dietary tips to promote clear, glowing skin from the inside out.",2024-05-09
Chemistry of Colors: Exploring Pigments and Dyes,Penny,"Colors are everywhere, but have you ever stopped to think about the chemistry behind them? Explore the fascinating world of pigments and dyes in this colorful blog post.",2024-05-10
The Mathematics of Art: Geometry in Design,Quinn,"Art and mathematics have been intertwined for centuries, with geometric principles playing a key role in design and composition. Explore the mathematics of art in this enlightening blog post.",2024-05-11
10 Quick and Easy Dessert Recipes,Ryan,"Satisfy your sweet tooth with these 10 quick and easy dessert recipes! From cookies and cakes to pies and puddings, there's something for everyone in this mouthwatering collection.",2024-05-12
